,STOP_ID,STOP_NAME,LATITUDE,LONGITUDE,TICKETZONE,ROUTEUSSP,geometry
0,19970,Royal Park Railway Station (Parkville),-37.781193,144.952301,1,Upfield,POINT (144.95230116 -37.7811929699999)
1,19971,Flemington Bridge Railway Station (North Melbourne),-37.78814,144.939323,1,Upfield,POINT (144.93932316 -37.78813998)
2,19972,Macaulay Railway Station (North Melbourne),-37.794267,144.936166,1,Upfield,POINT (144.93616596 -37.794267)
3,19973,North Melbourne Railway Station (West Melbourne),-37.807419,144.94257,1,"Flemington,Sunbury,Upfield,Werribee,Williamstown,Craigieburn",POINT (144.94257 -37.80741897)
4,19974,Clifton Hill Railway Station (Clifton Hill),-37.788657,144.995417,1,"Mernda,Hurstbridge",POINT (144.99541692 -37.78865703)
5,19975,Victoria Park Railway Station (Abbotsford),-37.799158,144.994451,1,"Mernda,Hurstbridge",POINT (144.99445104 -37.79915796)
6,19976,Collingwood Railway Station (Abbotsford),-37.804526,144.99375,1,"Mernda,Hurstbridge",POINT (144.99375012 -37.804526010000004)
7,19977,North Richmond Railway Station (Richmond),-37.810398,144.9925,1,"Mernda,Hurstbridge",POINT (144.99249984 -37.81039797)
8,19978,West Richmond Railway Station (Richmond),-37.814949,144.991423,1,"Mernda,Hurstbridge",POINT (144.99142308 -37.814949)
9,19979,Jolimont-MCG Railway Station (East Melbourne),-37.816527,144.984098,1,"Mernda,Hurstbridge",POINT (144.98409816 -37.81652697)
10,19983,Macleod Railway Station (Macleod),-37.726012,145.069143,2,Hurstbridge,POINT (145.06914312 -37.72601199)
11,19984,Watsonia Railway Station (Watsonia),-37.710958,145.083793,2,Hurstbridge,POINT (145.08379296 -37.71095796)
12,19985,Greensborough Railway Station (Greensborough),-37.703954,145.108247,2,Hurstbridge,POINT (145.10824704 -37.70395398)
13,19986,Montmorency Railway Station (Montmorency),-37.715296,145.121516,2,Hurstbridge,POINT (145.12151592 -37.71529596)
14,19987,Eltham Railway Station (Eltham),-37.71355,145.147822,2,Hurstbridge,POINT (145.14782184 -37.71354996)
15,19988,Diamond Creek Railway Station (Diamond Creek),-37.673297,145.158506,2,Hurstbridge,POINT (145.15850592 -37.67329701)
16,19989,Wattle Glen Railway Station (Wattle Glen),-37.663968,145.181615,2,Hurstbridge,POINT (145.18161504 -37.66396797)
17,19990,Hurstbridge Railway Station (Hurstbridge),-37.639398,145.192017,2,Hurstbridge,POINT (145.19201688 -37.63939797)
18,19991,Williamstown Railway Station (Williamstown),-37.867753,144.905323,1,Williamstown,POINT (144.90532296 -37.86775299)
19,19992,Williamstown Beach Railway Station (Williamstown),-37.863982,144.894484,1,Williamstown,POINT (144.89448408 -37.86398199)
20,19993,North Williamstown Railway Station (Williamstown),-37.857333,144.889069,1,Williamstown,POINT (144.88906896 -37.85733297)
21,19994,Newport Railway Station (Newport),-37.842718,144.8836,1,"Williamstown,Werribee",POINT (144.88359984 -37.84271796)
22,19995,Spotswood Railway Station (Spotswood),-37.830639,144.885933,1,"Williamstown,Werribee",POINT (144.885933 -37.83063897)
23,19996,Yarraville Railway Station (Yarraville),-37.81585,144.889934,1,"Williamstown,Werribee",POINT (144.88993404 -37.81584999)
24,19997,Seddon Railway Station (Seddon),-37.809005,144.895672,1,"Williamstown,Werribee",POINT (144.89567208 -37.80900504)
25,20000,Watergardens Railway Station (Sydenham),-37.701129,144.77418,2,Sunbury,POINT (144.77418 -37.70112897)
26,20001,Keilor Plains Railway Station (St Albans),-37.729279,144.793738,2,Sunbury,POINT (144.79373808 -37.72927899)
27,20002,St Albans Railway Station (St Albans),-37.744861,144.80005,2,Sunbury,POINT (144.80004996 -37.74486096)
28,20003,Ginifer Railway Station (St Albans),-37.760067,144.811348,2,Sunbury,POINT (144.81134784 -37.760067)
29,20004,Albion Railway Station (Sunshine North),-37.777653,144.824704,"1,2",Sunbury,POINT (144.82470384 -37.777653)
30,20005,Epping Railway Station (Epping),-37.652187,145.031068,2,Mernda,POINT (145.03106808 -37.65218697)
31,20006,Lalor Railway Station (Lalor),-37.665851,145.017193,2,Mernda,POINT (145.01719296 -37.66585103999989)
32,20007,Thomastown Railway Station (Thomastown),-37.680338,145.014279,2,Mernda,POINT (145.01427912 -37.68033798)
33,20008,Keon Park Railway Station (Thomastown),-37.69487,145.011884,2,Mernda,POINT (145.01188404 -37.69487001)
34,20009,Ruthven Railway Station (Reservoir),-37.707898,145.009517,2,Mernda,POINT (145.00951704 -37.70789796)
35,20010,Reservoir Railway Station (Reservoir),-37.716885,145.006996,"1,2",Mernda,POINT (145.00699596 -37.716885)
36,20011,Regent Railway Station (Reservoir),-37.728403,145.002773,"1,2",Mernda,POINT (145.00277316 -37.72840302)
37,20012,Preston Railway Station (Preston),-37.738674,145.000522,"1,2",Mernda,POINT (145.00052208 -37.738673999999996)
38,20013,Bell Railway Station (Preston),-37.745562,145.000155,1,Mernda,POINT (145.00015488 -37.74556197)
39,20014,Thornbury Railway Station (Thornbury),-37.755052,144.998572,1,Mernda,POINT (144.99857196 -37.75505202)
40,20015,Croxton Railway Station (Northcote),-37.764101,144.997056,1,Mernda,POINT (144.997056 -37.76410098)
41,20016,Northcote Railway Station (Northcote),-37.769865,144.995277,1,Mernda,POINT (144.99527688 -37.76986503)
42,20017,Merri Railway Station (Northcote),-37.777847,144.992972,1,Mernda,POINT (144.99297216 -37.77784704)
43,20019,Rushall Railway Station (Fitzroy North),-37.783217,144.992407,1,Mernda,POINT (144.99240696 -37.78321698)
44,20021,Sunshine Railway Station (Sunshine),-37.788536,144.832878,"1,2",Sunbury,POINT (144.832878 -37.7885359799999)
45,20022,Tottenham Railway Station (West Footscray),-37.799251,144.862945,1,Sunbury,POINT (144.86294484 -37.79925102)
46,20023,West Footscray Railway Station (West Footscray),-37.801803,144.883985,1,Sunbury,POINT (144.88398504 -37.80180297)
47,20024,Middle Footscray Railway Station (Footscray),-37.802505,144.891472,1,Sunbury,POINT (144.89147196 -37.80250497)
48,20025,Footscray Railway Station (Footscray),-37.801083,144.903199,1,"Werribee,Williamstown,Sunbury",POINT (144.90319896 -37.80108297)
49,20026,South Kensington Railway Station (Kensington),-37.799531,144.925469,1,"Williamstown,Werribee",POINT (144.92546892 -37.79953101)
50,20030,Broadmeadows Railway Station (Broadmeadows),-37.683049,144.919613,2,Craigieburn,POINT (144.91961316 -37.68304896)
51,20031,Jacana Railway Station (Glenroy),-37.695131,144.915851,2,Craigieburn,POINT (144.91585116 -37.69513101)
52,20032,Glenroy Railway Station (Glenroy),-37.704536,144.91722,"1,2",Craigieburn,POINT (144.91721988 -37.70453601)
53,20033,Oak Park Railway Station (Oak Park),-37.71795,144.921519,"1,2",Craigieburn,POINT (144.921519 -37.7179499699999)
54,20034,Pascoe Vale Railway Station (Pascoe Vale),-37.730756,144.928196,"1,2",Craigieburn,POINT (144.92819592 -37.73075598)
55,20035,Strathmore Railway Station (Strathmore),-37.743591,144.927316,1,Craigieburn,POINT (144.92731608 -37.74359097)
56,20036,Glenbervie Railway Station (Essendon),-37.74721,144.920939,1,Craigieburn,POINT (144.92093904 -37.74720996)
57,20037,Essendon Railway Station (Essendon),-37.756012,144.916198,1,Craigieburn,POINT (144.91619784 -37.75601196)
58,20038,Moonee Ponds Railway Station (Moonee Ponds),-37.765707,144.919161,1,Craigieburn,POINT (144.919161 -37.76570703)
59,20039,Ascot Vale Railway Station (Ascot Vale),-37.775306,144.921821,1,Craigieburn,POINT (144.92182104 -37.77530598)
60,20040,Newmarket Railway Station (Flemington),-37.787328,144.928978,1,Craigieburn,POINT (144.92897784 -37.787327999999995)
61,20041,Kensington Railway Station (Kensington),-37.79378,144.930524,1,Craigieburn,POINT (144.93052404 -37.79378001)
62,20042,Box Hill Railway Station (Box Hill),-37.819222,145.121429,2,"Lilydale,Belgrave",POINT (145.12142916 -37.81922202)
63,22180,Southern Cross Railway Station (Melbourne City),-37.817936,144.951411,1,"Belgrave,Craigieburn,Cranbourne,Flemington,Frankston,Glen Waverley,Hurstbridge,Lilydale,Mernda,Pakenham,Sandringham,Sunbury,Upfield,Werribee,Williamstown,Alamein",POINT (144.95141088 -37.81793601)
64,40220,Roxburgh Park Railway Station (Roxburgh Park),-37.638231,144.935404,2,Craigieburn,POINT (144.93540384 -37.63823103)
65,40221,Craigieburn Railway Station (Craigieburn),-37.601817,144.94332,2,Craigieburn,POINT (144.94331988 -37.6018170299999)
66,44817,Coolaroo Railway Station (Coolaroo),-37.661003,144.926056,2,Craigieburn,POINT (144.92605608 -37.66100301)
67,45793,Lynbrook Railway Station (Lynbrook),-38.057341,145.249275,2,Cranbourne,POINT (145.24927488 -38.05734096)
68,45794,Cardinia Road Railway Station (Pakenham),-38.07129,145.437791,2,Pakenham,POINT (145.43779104 -38.07128997)
69,45795,South Morang Railway Station (South Morang),-37.649159,145.067032,2,Mernda,POINT (145.06703208 -37.64915901)
70,46468,Williams Landing Railway Station (Williams Landing),-37.869865,144.747445,2,Werribee,POINT (144.74744496 -37.86986502)
71,52095,Southland Railway Station (Cheltenham),-37.958756,145.049121,2,Frankston,POINT (145.049121 -37.95875604)
72,52159,Middle Gorge Railway Station (South Morang),-37.644061,145.092144,2,Mernda,POINT (145.09214388 -37.64406096)
73,52160,Hawkstowe Railway Station (South Morang),-37.622995,145.097396,2,Mernda,POINT (145.09739592 -37.62299502)
74,52161,Mernda Railway Station (Mernda),-37.602548,145.100885,2,Mernda,POINT (145.10088504 -37.60254801)
75,15351,Sunbury Railway Station (Sunbury),-37.579091,144.727319,2,Sunbury,POINT (144.72731916 -37.57909104)
76,15353,Diggers Rest Railway Station (Diggers Rest),-37.627017,144.719922,2,Sunbury,POINT (144.71992188 -37.62701703)
77,19827,Stony Point Railway Station (Crib Point),-38.374235,145.221837,2,Stony Point,POINT (145.22183712 -38.3742350099999)
78,19828,Crib Point Railway Station (Crib Point),-38.366123,145.204043,2,Stony Point,POINT (145.20404304 -38.36612304)
79,19829,Morradoo Railway Station (Crib Point),-38.354033,145.189602,2,Stony Point,POINT (145.189602 -38.35403298)
80,19830,Bittern Railway Station (Bittern),-38.33739,145.178027,2,Stony Point,POINT (145.17802692 -38.33739)
81,19831,Hastings Railway Station (Hastings),-38.305659,145.18598,2,Stony Point,POINT (145.18598004 -38.30565897)
82,19832,Tyabb Railway Station (Tyabb),-38.259815,145.186401,2,Stony Point,POINT (145.18640088 -38.25981504)
83,19833,Somerville Railway Station (Somerville),-38.225342,145.176245,2,Stony Point,POINT (145.17624492 -38.22534198)
84,19834,Baxter Railway Station (Baxter),-38.194043,145.160526,2,Stony Point,POINT (145.16052588 -38.19404304)
85,19835,Glen Iris Railway Station (Glen Iris),-37.859308,145.058225,1,Glen Waverley,POINT (145.05822504 -37.85930802)
86,19836,Leawarra Railway Station (Frankston),-38.152034,145.139534,2,Stony Point,POINT (145.13953392 -38.15203401)
87,19837,Darling Railway Station (Malvern East),-37.868957,145.062951,"1,2",Glen Waverley,POINT (145.06295112 -37.86895701)
88,19838,East Malvern Railway Station (Malvern East),-37.87693,145.069393,"1,2",Glen Waverley,POINT (145.06939296 -37.87693002)
89,19839,Holmesglen Railway Station (Malvern East),-37.874402,145.090662,"1,2",Glen Waverley,POINT (145.09066212 -37.87440201)
90,19840,Jordanville Railway Station (Mount Waverley),-37.873603,145.11209,2,Glen Waverley,POINT (145.11209004 -37.87360299)
91,19841,Flagstaff Railway Station (Melbourne City),-37.811981,144.955654,1,"Belgrave,Craigieburn,Cranbourne,Flemington,Glen Waverley,Hurstbridge,Lilydale,Mernda,Pakenham,Sunbury,Upfield,Alamein",POINT (144.95565384 -37.81198098)
92,19842,Melbourne Central Railway Station (Melbourne City),-37.809939,144.962594,1,"Belgrave,Craigieburn,Cranbourne,Flemington,Glen Waverley,Hurstbridge,Lilydale,Mernda,Pakenham,Sunbury,Upfield,Alamein",POINT (144.96259392 -37.80993897)
93,19843,Parliament Railway Station (Melbourne City),-37.811054,144.972911,1,"Belgrave,Craigieburn,Cranbourne,Flemington,Glen Waverley,Hurstbridge,Lilydale,Mernda,Pakenham,Sunbury,Upfield,Alamein",POINT (144.97291116 -37.81105398)
94,19844,Belgrave Railway Station (Belgrave),-37.909102,145.355291,2,Belgrave,POINT (145.35529092 -37.90910196)
95,19845,Tecoma Railway Station (Tecoma),-37.908118,145.342995,2,Belgrave,POINT (145.34299512 -37.90811799)
96,19846,Upwey Railway Station (Upwey),-37.903691,145.331333,2,Belgrave,POINT (145.33133292 -37.90369098)
97,19847,Alamein Railway Station (Ashburton),-37.86832,145.079656,1,Alamein,POINT (145.07965584 -37.86831999)
98,19848,Ashburton Railway Station (Ashburton),-37.861968,145.081344,1,Alamein,POINT (145.08134388 -37.86196797)
99,19849,Burwood Railway Station (Glen Iris),-37.851563,145.080511,1,Alamein,POINT (145.08051084 -37.85156298)
100,19850,Hartwell Railway Station (Camberwell),-37.843985,145.07556,1,Alamein,POINT (145.07556012 -37.84398498)
101,19851,Willison Railway Station (Camberwell),-37.835716,145.070298,1,Alamein,POINT (145.070298 -37.83571596)
102,19852,Riversdale Railway Station (Camberwell),-37.831505,145.069646,1,Alamein,POINT (145.06964604 -37.83150504)
103,19853,Camberwell Railway Station (Camberwell),-37.826567,145.058697,1,"Belgrave,Lilydale,Alamein",POINT (145.058697 -37.82656701)
104,19854,Flinders Street Railway Station (Melbourne City),-37.818305,144.966964,1,"Belgrave,Craigieburn,Cranbourne,Flemington,Frankston,Glen Waverley,Hurstbridge,Lilydale,Mernda,Pakenham,Sandringham,Sunbury,Upfield,Werribee,Williamstown,Alamein",POINT (144.96696396 -37.81830501)
105,19855,Frankston Railway Station (Frankston),-38.14299,145.126162,2,"Stony Point,Frankston",POINT (145.12616208 -38.14299)
106,19856,Kananook Railway Station (Seaford),-38.121742,145.135295,2,Frankston,POINT (145.13529492 -38.12174199)
107,19857,Seaford Railway Station (Seaford),-38.104021,145.12823,2,Frankston,POINT (145.12822992 -38.10402099)
108,19858,Carrum Railway Station (Carrum),-38.076504,145.122833,2,Frankston,POINT (145.12283316 -38.07650403)
109,19859,Bonbeach Railway Station (Bonbeach),-38.062945,145.11968,2,Frankston,POINT (145.11967992 -38.06294499)
110,19860,Chelsea Railway Station (Chelsea),-38.051955,145.116041,2,Frankston,POINT (145.11604104 -38.051955)
111,19861,Edithvale Railway Station (Edithvale),-38.038056,145.108536,2,Frankston,POINT (145.10853612 -38.03805603)
112,19862,Aspendale Railway Station (Aspendale),-38.02722,145.10215,2,Frankston,POINT (145.10215008 -38.02722003)
113,19863,Mordialloc Railway Station (Mordialloc),-38.006583,145.087659,2,Frankston,POINT (145.087659 -38.00658303)
114,19864,Parkdale Railway Station (Parkdale),-37.993079,145.076327,2,Frankston,POINT (145.07632692 -37.99307898)
115,19865,Mentone Railway Station (Mentone),-37.981865,145.065166,2,Frankston,POINT (145.06516584 -37.98186498)
116,19866,Cheltenham Railway Station (Cheltenham),-37.96665,145.054558,2,Frankston,POINT (145.05455808 -37.96665003)
117,19867,Upper Ferntree Gully Railway Station (Upper Ferntree Gully),-37.892672,145.30753,2,Belgrave,POINT (145.30753008 -37.89267201)
118,19868,Ferntree Gully Railway Station (Ferntree Gully),-37.881698,145.295251,2,Belgrave,POINT (145.29525084 -37.88169804)
119,19869,Boronia Railway Station (Boronia),-37.860452,145.284385,2,Belgrave,POINT (145.28438496 -37.86045201)
120,19870,Bayswater Railway Station (Bayswater),-37.84173,145.268136,2,Belgrave,POINT (145.268136 -37.84173003)
121,19871,Heathmont Railway Station (Heathmont),-37.828322,145.244555,2,Belgrave,POINT (145.24455492 -37.82832201)
122,19872,Highett Railway Station (Highett),-37.948425,145.041872,2,Frankston,POINT (145.04187204 -37.94842503)
123,19873,Glen Waverley Railway Station (Glen Waverley),-37.879504,145.162058,2,Glen Waverley,POINT (145.16205804 -37.87950402)
124,19874,Syndal Railway Station (Glen Waverley),-37.87623,145.14978,2,Glen Waverley,POINT (145.14977988 -37.87623)
125,19875,Mount Waverley Railway Station (Mount Waverley),-37.875255,145.128056,2,Glen Waverley,POINT (145.12805604 -37.87525503)
126,19876,Lilydale Railway Station (Lilydale),-37.755518,145.34771,2,Lilydale,POINT (145.34771004 -37.75551804)
127,19877,Mooroolbark Railway Station (Mooroolbark),-37.784749,145.312402,2,Lilydale,POINT (145.31240196 -37.78474896)
128,19878,Croydon Railway Station (Croydon),-37.795437,145.280598,2,Lilydale,POINT (145.28059812 -37.795437)
129,19879,Ringwood East Railway Station (Ringwood East),-37.811968,145.250191,2,Lilydale,POINT (145.25019108 -37.81196802)
130,19880,Pakenham Railway Station (Pakenham),-38.080614,145.486379,2,Pakenham,POINT (145.48637916 -38.08061397)
131,19881,Officer Railway Station (Officer),-38.066146,145.410987,2,Pakenham,POINT (145.41098688 -38.06614602)
132,19882,Beaconsfield Railway Station (Beaconsfield),-38.050831,145.366074,2,Pakenham,POINT (145.366074 -38.05083099)
133,19883,Berwick Railway Station (Berwick),-38.040408,145.345726,2,Pakenham,POINT (145.34572608 -38.040408)
134,19884,Narre Warren Railway Station (Narre Warren),-38.027809,145.303969,2,Pakenham,POINT (145.30396896 -38.02780899)
135,19885,Hallam Railway Station (Hallam),-38.01774,145.269777,2,Pakenham,POINT (145.26977688 -38.01773997)
136,19886,Cranbourne Railway Station (Cranbourne),-38.099537,145.280599,2,Cranbourne,POINT (145.28059884 -38.0995370099999)
137,19887,Merinda Park Railway Station (Cranbourne North),-38.079,145.263511,2,Cranbourne,POINT (145.26351108 -38.079)
138,19888,Dandenong Railway Station (Dandenong),-37.989968,145.209725,2,"Pakenham,Cranbourne",POINT (145.20972492 -37.98996804)
139,19889,Yarraman Railway Station (Noble Park),-37.978255,145.1916,2,"Pakenham,Cranbourne",POINT (145.1916 -37.97825499)
140,19890,Noble Park Railway Station (Noble Park),-37.966628,145.176325,2,"Pakenham,Cranbourne",POINT (145.17632484 -37.96662798)
141,19891,Sandown Park Railway Station (Springvale),-37.956505,145.162826,2,"Pakenham,Cranbourne",POINT (145.16282592 -37.95650496)
142,19892,East Camberwell Railway Station (Camberwell),-37.825894,145.06819,1,"Lilydale,Belgrave",POINT (145.06818984 -37.82589399)
143,19893,Canterbury Railway Station (Canterbury),-37.824485,145.081224,"1,2","Lilydale,Belgrave",POINT (145.081224 -37.82448504)
144,19894,Chatham Railway Station (Surrey Hills),-37.8243,145.088648,"1,2","Lilydale,Belgrave",POINT (145.08864792 -37.8243)
145,19895,Surrey Hills Railway Station (Surrey Hills),-37.824148,145.098775,"1,2","Lilydale,Belgrave",POINT (145.09877508 -37.82414799)
146,19896,Mont Albert Railway Station (Mont Albert),-37.819427,145.10553,"1,2","Lilydale,Belgrave",POINT (145.10553012 -37.81942704)
147,19897,Laburnum Railway Station (Blackburn),-37.82078,145.140703,2,"Lilydale,Belgrave",POINT (145.14070284 -37.82078001)
148,19898,Blackburn Railway Station (Blackburn),-37.820071,145.150014,2,"Lilydale,Belgrave",POINT (145.15001388 -37.82007099)
149,19899,Nunawading Railway Station (Nunawading),-37.820428,145.175237,2,"Lilydale,Belgrave",POINT (145.17523692 -37.82042802)
150,19900,Mitcham Railway Station (Mitcham),-37.818087,145.192892,2,"Lilydale,Belgrave",POINT (145.19289204 -37.81808703)
151,19901,Heatherdale Railway Station (Ringwood),-37.818835,145.21355,2,"Lilydale,Belgrave",POINT (145.21354992 -37.81883502)
152,19902,Ringwood Railway Station (Ringwood),-37.81566,145.229474,2,"Lilydale,Belgrave",POINT (145.22947416 -37.81566)
153,19903,Auburn Railway Station (Hawthorn East),-37.822398,145.045844,1,"Belgrave,Lilydale,Alamein",POINT (145.04584392 -37.82239803)
154,19904,Glenferrie Railway Station (Hawthorn),-37.821467,145.036439,1,"Belgrave,Lilydale,Alamein",POINT (145.03643892 -37.82146698)
155,19905,Hawthorn Railway Station (Hawthorn),-37.821826,145.022899,1,"Belgrave,Lilydale,Alamein",POINT (145.02289896 -37.82182599)
156,19906,Burnley Railway Station (Burnley),-37.82756,145.007555,1,"Belgrave,Glen Waverley,Lilydale,Alamein",POINT (145.00755504 -37.82755998)
157,19907,East Richmond Railway Station (Richmond),-37.8264,144.997066,1,"Belgrave,Glen Waverley,Lilydale,Alamein",POINT (144.99706608 -37.82639997)
158,19908,Richmond Railway Station (Richmond),-37.824074,144.990164,1,"Belgrave,Cranbourne,Frankston,Glen Waverley,Lilydale,Pakenham,Sandringham,Alamein",POINT (144.99016416 -37.82407401)
159,19909,Heyington Railway Station (Toorak),-37.834672,145.022635,1,Glen Waverley,POINT (145.02263508 -37.83467196)
160,19910,Kooyong Railway Station (Kooyong),-37.839929,145.033552,1,Glen Waverley,POINT (145.03355208 -37.83992904)
161,19911,Tooronga Railway Station (Malvern),-37.849366,145.041734,1,Glen Waverley,POINT (145.04173416 -37.84936599)
162,19912,Gardiner Railway Station (Glen Iris),-37.853279,145.051655,1,Glen Waverley,POINT (145.05165504 -37.85327901)
163,19913,Springvale Railway Station (Springvale),-37.949509,145.153452,2,"Pakenham,Cranbourne",POINT (145.15345188 -37.94950899)
164,19914,Westall Railway Station (Clayton South),-37.938491,145.138833,2,"Pakenham,Cranbourne",POINT (145.138833 -37.93849101)
165,19915,Clayton Railway Station (Clayton),-37.924683,145.120534,2,"Pakenham,Cranbourne",POINT (145.12053384 -37.92468303)
166,19916,Huntingdale Railway Station (Oakleigh),-37.911017,145.102364,"1,2","Pakenham,Cranbourne",POINT (145.10236392 -37.91101698)
167,19917,Oakleigh Railway Station (Oakleigh),-37.900372,145.088308,"1,2","Pakenham,Cranbourne",POINT (145.08830808 -37.90037196)
168,19918,Hughesdale Railway Station (Hughesdale),-37.894881,145.077635,"1,2","Pakenham,Cranbourne",POINT (145.07763516 -37.89488097)
169,19919,Murrumbeena Railway Station (Murrumbeena),-37.890198,145.067375,1,"Pakenham,Cranbourne",POINT (145.06737516 -37.890198)
170,19920,Carnegie Railway Station (Carnegie),-37.886241,145.058575,1,"Pakenham,Cranbourne",POINT (145.05857496 -37.88624097)
171,19921,Werribee Railway Station (Werribee),-37.899378,144.661118,2,Werribee,POINT (144.66111804 -37.899378)
172,19922,Hoppers Crossing Railway Station (Hoppers Crossing),-37.883276,144.700955,2,Werribee,POINT (144.70095492 -37.88327601)
173,19923,Laverton Railway Station (Laverton),-37.863694,144.772617,"1,2",Werribee,POINT (144.77261688 -37.86369399)
174,19924,Aircraft Railway Station (Laverton),-37.866606,144.760809,2,Werribee,POINT (144.76080888 -37.86660603)
175,19925,Westona Railway Station (Altona),-37.865163,144.813494,"1,2",Werribee,POINT (144.81349416 -37.86516297)
176,19926,Altona Railway Station (Altona),-37.867148,144.829645,"1,2",Werribee,POINT (144.82964484 -37.86714801)
177,19927,Seaholme Railway Station (Seaholme),-37.867842,144.840958,1,Werribee,POINT (144.84095784 -37.867841999999996)
178,19928,Westgarth Railway Station (Northcote),-37.780621,144.999233,1,Hurstbridge,POINT (144.99923292 -37.78062102)
179,19929,Dennis Railway Station (Northcote),-37.779187,145.008242,1,Hurstbridge,POINT (145.00824192 -37.77918696)
180,19930,Fairfield Railway Station (Fairfield),-37.779171,145.016905,1,Hurstbridge,POINT (145.01690496 -37.77917103)
181,19931,Alphington Railway Station (Alphington),-37.778394,145.031255,1,Hurstbridge,POINT (145.03125492 -37.77839397)
182,19932,Darebin Railway Station (Ivanhoe),-37.774963,145.038476,1,Hurstbridge,POINT (145.03847616 -37.77496298999989)
183,19933,Ivanhoe Railway Station (Ivanhoe),-37.768897,145.045425,"1,2",Hurstbridge,POINT (145.04542488 -37.76889699)
184,19934,Eaglemont Railway Station (Eaglemont),-37.763586,145.053943,"1,2",Hurstbridge,POINT (145.05394284 -37.763586)
185,19935,Heidelberg Railway Station (Heidelberg),-37.757073,145.060686,"1,2",Hurstbridge,POINT (145.060686 -37.75707297)
186,19936,Rosanna Railway Station (Rosanna),-37.742879,145.06614,2,Hurstbridge,POINT (145.06614 -37.74287898)
187,19937,Moorabbin Railway Station (Moorabbin),-37.934353,145.036738,2,Frankston,POINT (145.03673808 -37.93435299)
188,19938,Patterson Railway Station (Bentleigh),-37.925149,145.03547,2,Frankston,POINT (145.03547016 -37.92514896)
189,19939,Bentleigh Railway Station (Bentleigh),-37.917425,145.036995,"1,2",Frankston,POINT (145.03699512 -37.91742498)
190,19940,McKinnon Railway Station (Mckinnon),-37.910309,145.038299,"1,2",Frankston,POINT (145.03829904 -37.91030904)
191,19941,Ormond Railway Station (Ormond),-37.903212,145.039613,"1,2",Frankston,POINT (145.03961304 -37.903211999999996)
192,19942,Glenhuntly Railway Station (Glen Huntly),-37.889719,145.042223,1,Frankston,POINT (145.04222304 -37.88971902)
193,19943,Caulfield Railway Station (Caulfield East),-37.877459,145.042525,1,"Frankston,Pakenham,Cranbourne",POINT (145.04252508 -37.87745904)
194,19944,Malvern Railway Station (Malvern),-37.866253,145.029294,1,Frankston,POINT (145.029294 -37.86625296)
195,19945,Armadale Railway Station (Armadale),-37.856452,145.019326,1,Frankston,POINT (145.01932596 -37.85645196)
196,19946,Toorak Railway Station (Armadale),-37.850774,145.013909,1,Frankston,POINT (145.01390904 -37.85077404)
197,19947,Hawksburn Railway Station (South Yarra),-37.844591,145.002142,1,Frankston,POINT (145.00214208 -37.84459104)
198,19948,Sandringham Railway Station (Sandringham),-37.95033,145.004561,2,Sandringham,POINT (145.00456092 -37.95032997)
199,19949,Hampton Railway Station (Hampton),-37.937977,145.001471,2,Sandringham,POINT (145.00147104 -37.93797702)
200,19950,Brighton Beach Railway Station (Brighton),-37.926484,144.989154,"1,2",Sandringham,POINT (144.98915399999998 -37.92648402)
201,19951,Middle Brighton Railway Station (Brighton),-37.915134,144.996299,"1,2",Sandringham,POINT (144.99629892 -37.91513403)
202,19952,North Brighton Railway Station (Brighton),-37.904887,145.002605,"1,2",Sandringham,POINT (145.00260504 -37.90488699)
203,19953,Gardenvale Railway Station (Brighton),-37.896695,145.004168,1,Sandringham,POINT (145.00416816 -37.89669501)
204,19954,Elsternwick Railway Station (Elsternwick),-37.884753,145.000898,1,Sandringham,POINT (145.00089792 -37.884752999999996)
205,19955,Ripponlea Railway Station (Ripponlea),-37.875906,144.995237,1,Sandringham,POINT (144.99523692 -37.875906)
206,19956,Balaclava Railway Station (Balaclava),-37.869488,144.993512,1,Sandringham,POINT (144.99351216 -37.86948801)
207,19957,Windsor Railway Station (Windsor),-37.856053,144.992035,1,Sandringham,POINT (144.99203508 -37.85605299)
208,19958,Prahran Railway Station (Prahran),-37.849518,144.98986,1,Sandringham,POINT (144.98985996 -37.849517999999996)
