,STOP_ID,STOP_NAME,LATITUDE,LONGITUDE,TICKETZONE,ROUTEUSSP,geometry
209,19959,South Yarra Railway Station (South Yarra),-37.838449,144.992342,1,"Frankston,Pakenham,Sandringham,Cranbourne",POINT (144.99234216 -37.83844899)
210,19960,Upfield Railway Station (Coolaroo),-37.666078,144.94674,2,Upfield,POINT (144.94673988 -37.66607802)
211,19961,Gowrie Railway Station (Glenroy),-37.700678,144.958874,2,Upfield,POINT (144.95887404 -37.70067798)
212,19962,Fawkner Railway Station (Fawkner),-37.714621,144.960545,"1,2",Upfield,POINT (144.96054516 -37.71462096)
213,19963,Merlynston Railway Station (Coburg North),-37.720934,144.961314,"1,2",Upfield,POINT (144.96131412 -37.72093401)
214,19964,Batman Railway Station (Coburg North),-37.733523,144.962841,"1,2",Upfield,POINT (144.96284088 -37.73352303)
215,19965,Coburg Railway Station (Coburg),-37.742345,144.963336,1,Upfield,POINT (144.96333588 -37.74234501)
216,19966,Moreland Railway Station (Coburg),-37.754485,144.961823,1,Upfield,POINT (144.96182316 -37.75448502)
217,19967,Anstey Railway Station (Brunswick),-37.761242,144.960684,1,Upfield,POINT (144.96068412 -37.76124204)
218,19968,Brunswick Railway Station (Brunswick),-37.767721,144.959587,1,Upfield,POINT (144.95958684 -37.76772096)
219,19969,Jewell Railway Station (Brunswick),-37.774987,144.958717,1,Upfield,POINT (144.95871708 -37.77498702)
